{"case_id":"F2-short","run_id":"F2S-FIXED-PILOT-MEDIUM2","protocol_conformant":true,"audit_valid":true,"cycles_used":3,"terminal_findings":[{"finding_ref":"FINDING-1","status":"OPEN","axis":"materiality","mechanism":"Normalization or reviewed equivalence can classify independently actionable impacts as one material failure.","precondition":"Two occurrences share an axis and mechanism ID but have materially distinct observable impacts.","event":"Normalization produces the same failure identity, or review approves equivalence without validated material-equivalence and consumer-closure semantics.","observable_failure":"The settled view counts the distinct impacts as one finding.","falsifier":"Verified cases show that same-identity impacts always form one closure unit, or that all consumers preserve distinct prioritization and closure despite deduplication.","first_observed_stage":"P0"},{"finding_ref":"FINDING-2","status":"RESOLVED","axis":"revision effects","mechanism":"A cross-revision merge could ignore changed handler effects while retaining the mechanism ID.","precondition":"H0 and H1 share the axis, mechanism ID, and failure identity.","event":"The handler changes from suppressed publication with automatic retry to provisional publication with manual triage and no retry.","observable_failure":"Materially distinct operational outcomes are collapsed into one settled finding.","falsifier":"The typed all-known/all-equal revision predicate and negative H0-to-H1 conformance test keep the outcomes distinct.","first_observed_stage":"REVISION"},{"finding_ref":"FINDING-3","status":"OPEN","axis":"audit semantics","mechanism":"Historical projections may be unreproducible if referenced policy artifacts, serialization rules, or epoch data are unavailable.","precondition":"Normalization or revision policy changes across view epochs.","event":"Rollback or replay attempts to reconstruct an earlier view without verified immutable artifacts and retention guarantees.","observable_failure":"Previously published membership, statuses, totals, reasons, or effective timestamps cannot be reproduced.","falsifier":"A retained-artifact v1-to-v2-to-rollback replay byte-matches the canonical historical projection.","first_observed_stage":"REVISION"},{"finding_ref":"FINDING-4","status":"INDETERMINATE","axis":"revision effects","mechanism":"The general RevisionSemantics schema may omit a decision-relevant operational obligation.","precondition":"Two revisions differ in an unmodeled obligation while every modeled field matches.","event":"The all-known/all-equal predicate evaluates only the modeled fields.","observable_failure":"Materially distinct revision outcomes may be classified as duplicates.","falsifier":"Schema-completeness evidence and negative mutation cases demonstrate coverage of all decision-relevant obligations.","first_observed_stage":"CHIEF_DECISION"}],"chief_disposition":"DEFER","limitations":["The closed-world record contains no validated material-equivalence or downstream consumer-closure evidence for FINDING-1.","General revision-schema completeness remains unproven for FINDING-4.","Historical replay, immutable retention, canonical serialization, timestamp integrity, and artifact-recovery evidence are missing for FINDING-3.","Thread freshness and isolation are supported by separate fresh-thread setup and routed-input boundaries, not by claims of cognitive independence."]}