{"case_id":"F3-noisy","run_id":"F3N-ADAPTIVE-P4-MEDIUM1","protocol_conformant":true,"audit_valid":true,"cycles_used":0,"terminal_findings":[],"chief_disposition":"APPROVE","limitations":["HYPOTHETICAL: Exact label name, encoding, API, and deployment-toggle details are unspecified and non-blocking.","HYPOTHETICAL: Resource overhead, consumer tolerance, production topology, and capacity state are unspecified and non-blocking."]}