{"case_id":"F2-noisy","run_id":"F2N-FIXED-T2-MEDIUM1","protocol_conformant":true,"audit_valid":true,"cycles_used":3,"terminal_findings":[{"finding_ref":"FINDING-1","status":"RESOLVED","axis":"materiality","mechanism":"key-only deduplication","precondition":"Same axis and mechanism ID occur with materially distinct behavior.","event":"A later manifestation collides with the existing key.","observable_failure":"The distinct behavior loses separate actionability.","falsifier":"Manifestations remain separately actionable unless current material equivalence is proven.","first_observed_stage":"P0"},{"finding_ref":"FINDING-2","status":"OPEN","axis":"revision effects","mechanism":"material-equivalence adjudication","precondition":"Merging is enabled.","event":"proven_duplicate is applied without a validated rule and representative corpus.","observable_failure":"Materially distinct manifestations are falsely merged.","falsifier":"A validated corpus demonstrates no false merges, including H0/H1 and current-revision-only proof cases.","first_observed_stage":"P0"},{"finding_ref":"FINDING-3","status":"OPEN","axis":"revision effects","mechanism":"migration collision replay","precondition":"Legacy state is shadow-replayed.","event":"The read switch occurs without validating collision handling.","observable_failure":"Projected open counts or audit chronology are incorrect.","falsifier":"Validated replay demonstrates correct aliases, counts, chronology, and rollback.","first_observed_stage":"P0"},{"finding_ref":"FINDING-4","status":"RESOLVED","axis":"audit semantics","mechanism":"adjudication provenance","precondition":"Manifestations merge and the canonical finding is resolved.","event":"Historical projection and resolution scope are reconstructed.","observable_failure":"The governing decision, evidence, coverage, or revision history cannot be reconstructed.","falsifier":"Immutable adjudication and resolution-coverage events plus deterministic boundary replay reconstruct every projection.","first_observed_stage":"REVISION"}],"chief_disposition":"APPROVE_WITH_REQUIRED_CHANGES","limitations":["Closed-world run; no external evidence was inspected.","Enable proven-duplicate projection only after the material-equivalence rule and corpus pass validation.","Do not perform the migration read switch until collision replay, counts, aliases, chronology, and rollback are validated."]}