{"case_id":"F2-short","run_id":"F2S-FIXED-PILOT-MEDIUM1","protocol_conformant":true,"audit_valid":true,"cycles_used":3,"terminal_findings":[{"finding_ref":"FINDING-1","status":"RESOLVED","axis":"materiality","mechanism":"Latest-occurrence projection could suppress an earlier unresolved material occurrence.","precondition":"A lineage contains an unresolved material occurrence.","event":"A later same-key occurrence is classified non-material without explicit resolution.","observable_failure":"The concern appears neither open nor resolved in terminal output.","falsifier":"A sticky-open test shows the lineage remains open until explicit targeted resolution.","first_observed_stage":"P0"},{"finding_ref":"FINDING-2","status":"RESOLVED","axis":"revision effects","mechanism":"Ungrouped quarantine could detach a correction from its revision provenance.","precondition":"A valid same-mechanism occurrence is falsely rejected by identity validation.","event":"A corrected occurrence later enters the group without projected quarantine provenance.","observable_failure":"The grouped audit view cannot explain the correction's origin.","falsifier":"Immutable bidirectional correction links and grouped provenance are traversable while remaining terminal-inert.","first_observed_stage":"REVISION"},{"finding_ref":"FINDING-3","status":"RESOLVED","axis":"audit semantics","mechanism":"The axis-and-mechanism group key was treated as semantic concern identity.","precondition":"A failure-handler revision creates two distinct concerns under the same group key.","event":"Resolution evidence targets only one concern.","observable_failure":"Both concerns are falsely closed or remain undifferentiated.","falsifier":"Two same-key concern lineages retain separate open and resolved statuses when only one is resolved.","first_observed_stage":"REVISION"},{"finding_ref":"FINDING-4","status":"OPEN","axis":"revision effects / audit semantics","mechanism":"A retained mechanism ID may mask material mechanism replacement.","precondition":"No explicit mechanism-identity contract defines continuity across revisions.","event":"The handler or mechanism changes while retaining its ID.","observable_failure":"Distinct mechanisms or concerns may be falsely deduplicated.","falsifier":"Contract-backed replacement and retention tests classify mechanism continuity deterministically.","first_observed_stage":"P0"},{"finding_ref":"FINDING-5","status":"OPEN","axis":"materiality / audit semantics","mechanism":"An apparently valid but erroneous concern-lineage assignment can silently split or merge concerns.","precondition":"Lineage-adjudication evidence is absent.","event":"An occurrence is assigned to the wrong lineage without triggering ambiguity handling.","observable_failure":"Terminal statuses silently merge unrelated concerns or split one concern.","falsifier":"Adjudication tests detect and correct apparently valid erroneous lineage assignments.","first_observed_stage":"REVISION"},{"finding_ref":"FINDING-6","status":"OPEN","axis":"audit semantics","mechanism":"Equivalent concerns with different mechanism IDs remain separated.","precondition":"Cross-ID semantic equivalence exists.","event":"Occurrences are grouped strictly by axis and mechanism ID.","observable_failure":"One concern is reported as multiple findings.","falsifier":"A demonstrated cross-ID equivalence case is correctly reconciled without false merging.","first_observed_stage":"P0"},{"finding_ref":"FINDING-7","status":"OPEN","axis":"revision effects","mechanism":"Immutable quarantine and provenance records accumulate.","precondition":"Malformed or corrected records persist for auditability.","event":"Repeated revisions generate quarantined records and links.","observable_failure":"Storage and human review load grow without a demonstrated operational bound.","falsifier":"Measured accumulation and review evidence demonstrates acceptable resource behavior.","first_observed_stage":"REVISION"}],"chief_disposition":"DEFER","limitations":["Core-only fixed-three-v1 run used three real separate threads: Proposing TL, Peer TL, and Chief Architect; no specialists or retries were used.","Peer received no proposal or preferred outcome before its first inspection. Chief was pre-reserved but received no proposal, debate history, or preferred outcome before the terminal packet.","The closed-world case provides no mechanism-identity contract or lineage-adjudication evidence; the Chief deferred pending those named gates.","R2 false separation and R4 audit/storage overhead remain open accepted limitations; acceptance does not mark them resolved."]}