{"case_id":"F2-noisy","run_id":"F2N-ADAPTIVE-P4-MEDIUM1","protocol_conformant":true,"audit_valid":true,"cycles_used":0,"terminal_findings":[],"chief_disposition":"APPROVE","limitations":["The handler's substantive behavior and material consequence were not supplied, so severity and remediation effects could not be assessed; this is non-blocking under the closed-world contract.","Broader predecessor-status behavior outside the specified P0-to-P1 replacement semantics is HYPOTHETICAL and non-blocking."]}