{"case_id":"F3-short","run_id":"F3S-ADAPTIVE-P4-MEDIUM1","protocol_conformant":true,"audit_valid":true,"cycles_used":0,"terminal_findings":[],"chief_disposition":"APPROVE","limitations":["Concrete label naming and value binding remain HYPOTHETICAL non-blocking implementation notes.","Backend, consumer, topology, privacy, capacity, and retention characteristics remain HYPOTHETICAL and created no evidence requirement or decision effect."]}