{"case_id":"F2-noisy","run_id":"F2N-ADAPTIVE-T2-MEDIUM1","protocol_conformant":true,"audit_valid":true,"cycles_used":3,"terminal_findings":[{"finding_ref":"FINDING-1","status":"RESOLVED","axis":"materiality","mechanism":"Canonical-oriented consumers could ignore occurrence-level severity because materiality was excluded from the deduplication key and lacked group aggregation.","precondition":"A low-materiality occurrence is canonical for a deduplication group.","event":"A severe occurrence with the same deduplication identity arrives.","observable_failure":"Triage retains the canonical occurrence's low severity and under-prioritizes the group.","falsifier":"A monotonic group maximum, mandatory consumer contract, escalation event, and low-to-severe propagation test.","first_observed_stage":"P0"},{"finding_ref":"FINDING-2","status":"RESOLVED","axis":"revision effects","mechanism":"Cross-revision identity originally trusted an unchanged axis and mechanism ID despite changed observable behavior.","precondition":"A revision retains its mechanism ID.","event":"P1 changes STORE_UNAVAILABLE handling from quarantine to durable journal and replay.","observable_failure":"A concern about the new handler can be marked duplicate of a concern about the old handler.","falsifier":"Behavioral fingerprints and versions separate changed handlers, while inconsistent same-version fingerprints become INDETERMINATE_IDENTITY.","first_observed_stage":"P0"},{"finding_ref":"FINDING-3","status":"RESOLVED","axis":"audit semantics","mechanism":"Immutable occurrences originally lacked append-only correction, supersession, and temporal-authority semantics.","precondition":"An earlier classification or canonical linkage is later found incorrect.","event":"A rebuild or adjudication changes the authoritative classification.","observable_failure":"Auditors cannot deterministically reconstruct the authoritative association for a requested time.","falsifier":"Append-only DECIDED and SUPERSEDED events with causality, bitemporal projections, integrity constraints, and deterministic replay tests.","first_observed_stage":"P0"},{"finding_ref":"FINDING-4","status":"OPEN","axis":"materiality","mechanism":"P1 defines monotonic maximum group materiality, but P3 does not define membership and de-escalation after supersession, removal, or reassignment.","precondition":"A severe occurrence has escalated a group's materiality.","event":"Its authoritative classification is superseded, removed, or moved to another group.","observable_failure":"Current-view consumers continue reporting severe materiality unsupported by any live group member.","falsifier":"View-specific projection tests derive materiality from live classifications with defined correction and de-escalation, or separate historical maximum from current severity.","first_observed_stage":"TERMINAL_RECONCILIATION"},{"finding_ref":"FINDING-S1-1","status":"OPEN","axis":"materiality / audit semantics","mechanism":"The earliest-accepted canonical rule lacks a total immutable ordering and atomic repair semantics for affected source and destination groups.","precondition":"A group has multiple accepted occurrences and an established canonical member.","event":"The canonical is corrected out, or a backdated earlier member enters or moves between groups.","observable_failure":"Consumers observe a stale or non-member canonical, incorrect materiality, or divergent replay results.","falsifier":"Define a total immutable ordering and atomically recompute canonical identity and materiality for both affected groups, with reassignment, rejection, and backdating tests.","first_observed_stage":"CHIEF_STAGE_1"},{"finding_ref":"FINDING-S1-2","status":"OPEN","axis":"audit semantics","mechanism":"Backdated supersession lacks complete interval-admissibility and two-dimensional effective-time/known-time selection rules.","precondition":"An authoritative event already begins at a later effective time.","event":"A subsequently recorded replacement is assigned an earlier effective time.","observable_failure":"Authority intervals become invalid or conflicting, causing effective-time and known-time projections to disagree or fail.","falsifier":"Specify interval-validity and effective-at/known-at selection rules that pass before-predecessor, equal-time tie, and repeated-rebuild tests.","first_observed_stage":"CHIEF_STAGE_1"}],"chief_disposition":"APPROVE_WITH_REQUIRED_CHANGES","limitations":["Closed-world run; no external evidence or unrelated workspace inspection was used.","Three separate fresh core threads were used: /root/proposing_tl, /root/peer_tl, and /root/chief_architect; no specialists were added.","Peer received no proposal before its first activated inspection. Chief received only a readiness contract before its blind terminal scan, then received the full record for reconciliation.","The three-cycle ceiling was reached. FINDING-4 and both blind-Chief findings remain open and require normative projection, canonical-repair, interval-boundary, and deterministic-rebuild gates before release."]}