{"case_id":"F3-short","run_id":"F3S-FIXED-T2-MEDIUM1","protocol_conformant":true,"audit_valid":true,"cycles_used":3,"terminal_findings":[{"finding_ref":"FINDING-1","status":"RESOLVED","axis":"correctness","mechanism":"P0 did not fully enforce structural isolation from shared state or upstream completion; P1/P3 require post-irrevocable, value-copy, fresh-object, detached non-awaited execution with contained failures.","precondition":"The decorator shares mutable tags or exposes emitter completion upstream.","event":"Label decoration mutates shared state or the emitter blocks or throws.","observable_failure":"Decision completion, latency, retries, or baseline telemetry changes.","falsifier":"G1 call-graph inspection and G2 failure-injection equivalence tests confirm one-way isolation and unchanged behavior.","first_observed_stage":"P0"},{"finding_ref":"FINDING-2","status":"OPEN","axis":"correctness","mechanism":"The terminal proposal specifies isolation, but no implementation artifact demonstrates conformance.","precondition":"Implementation differs from the declared post-decision detached topology.","event":"Telemetry failure propagates through shared state, callbacks, awaiting, or exceptions.","observable_failure":"Decision, status, retry count, completion behavior, or baseline metric output differs.","falsifier":"Passing G1 and G2 evidence for the actual implementation.","first_observed_stage":"P0"},{"finding_ref":"FINDING-3","status":"RESOLVED","axis":"operability","mechanism":"P2/P3 add baseline-capacity preservation, separate accounting, an independently reserved unlabeled diagnostic lane, and label-only rollback.","precondition":"Labeled and baseline telemetry share constrained resources.","event":"New label values increase series and queue load during peak traffic.","observable_failure":"Baseline metrics are delayed, dropped, or evicted while diagnostics disappear.","falsifier":"The specified G4 controlled load test demonstrates unchanged baseline delivery and operable saturation signals.","first_observed_stage":"P0"},{"finding_ref":"FINDING-4","status":"OPEN","axis":"operability","mechanism":"Actual exporter, backend, and query headroom remains unverified despite the terminal capacity gates.","precondition":"Existing telemetry operates near a resource or quota limit.","event":"All allowlisted label values activate across existing dimensions.","observable_failure":"Queue drops, memory pressure, quota exhaustion, query degradation, dashboard gaps, or alert churn.","falsifier":"G4 peak-load and cardinality evidence proves reserved capacity or sufficient measured headroom.","first_observed_stage":"P0"},{"finding_ref":"FINDING-5","status":"RESOLVED","axis":"compatibility","mechanism":"P3 replaces field-ingestion compatibility with blocking consumer-output equivalence across matching, grouping, joins, alerts, dashboards, exports, and validators.","precondition":"A consumer assumes the prior label set or single-series identity.","event":"The additive label splits series identity.","observable_failure":"Missing or many-to-many joins, duplicate or absent alerts, or dashboard fan-out.","falsifier":"The specified G5 inventory and enum-plus-unknown golden replay preserves all consumer-visible outputs.","first_observed_stage":"P0"},{"finding_ref":"FINDING-6","status":"OPEN","axis":"compatibility","mechanism":"No consumer inventory or golden replay results were supplied.","precondition":"An existing rule, dashboard, export, or validator depends on exact labels or implicit matching.","event":"The labeled metric is enabled.","observable_failure":"Consumer results diverge despite unchanged decision behavior.","falsifier":"Passing G5 evidence for every affected consumer and label value.","first_observed_stage":"P0"},{"finding_ref":"FINDING-7","status":"OPEN","axis":"correctness","mechanism":"The exact label key, enum, unknown semantics, designated metrics, and deterministic derivation mapping remain unspecified.","precondition":"Implementation selects ambiguous or inconsistent label semantics.","event":"Equivalent decisions receive inconsistent labels or unknown values are misinterpreted.","observable_failure":"Audit output is misleading and fails the intended visibility purpose.","falsifier":"G3 freezes and validates the complete label contract and mapping.","first_observed_stage":"P0"},{"finding_ref":"FINDING-8","status":"OPEN","axis":"compatibility","mechanism":"No evidence proves metric descriptors are excluded from schema-hash inputs.","precondition":"Schema hashing includes metric descriptors or label keysets.","event":"The audit label is added.","observable_failure":"The schema hash changes, violating the unchanged-schema invariant.","falsifier":"G6 demonstrates descriptor exclusion and an unchanged resulting schema hash.","first_observed_stage":"P0"}],"chief_disposition":"DEFER","limitations":["Closed-world case supplied no implementation, consumer, capacity, or schema-hash artifacts.","Isolation claims are limited to observable fresh-thread and separately-instructed setup; they do not claim cognitive independence.","No specialists were used, as required. The Chief received one complete-record handoff only after three closed rounds."]}