{"case_id":"F3-short","run_id":"F3S-FIXED-P4-MEDIUM1","protocol_conformant":true,"audit_valid":true,"cycles_used":3,"terminal_findings":[],"chief_disposition":"APPROVE","limitations":["HYPOTHETICAL: An unspecified downstream consumer could promote the label into a decision input; non-blocking.","HYPOTHETICAL: Label cardinality or backend resource costs could be adverse in an unspecified environment; non-blocking.","HYPOTHETICAL: An unspecified strict consumer or closed schema could reject the additive label; non-blocking.","The concrete label key, value domain, and encoding were not supplied and had no decision effect."]}