{"case_id":"F2-short","run_id":"F2S-ADAPTIVE-PILOT-MEDIUM1","protocol_conformant":true,"audit_valid":true,"cycles_used":3,"terminal_findings":[{"finding_ref":"FINDING-1","status":"RESOLVED","axis":"revision effects","mechanism":"Retained mechanism ID across changed failure handling","precondition":"A finding retains mechanism ID M across revisions while its failure handler changes.","event":"P1 changes Invalid/quarantine/no-route to Indeterminate/preserve/route.","observable_failure":"Stale fields could suppress the materially changed finding as a duplicate.","falsifier":"A path permits same-key deduplication before revision-boundary and canonical-effect evaluation.","first_observed_stage":"P0"},{"finding_ref":"FINDING-2","status":"INDETERMINATE","axis":"revision effects / audit semantics","mechanism":"Revision, artifact, and configuration provenance binding","precondition":"Authenticated binding evidence is absent or unbound.","event":"The system evaluates duplicate eligibility across claimed revision identities.","observable_failure":"Comparison identity cannot be authenticated; duplicate eligibility remains unproven.","falsifier":"Authenticated, replayable binding among finding, source revision, artifact, and configuration.","first_observed_stage":"REVISION"},{"finding_ref":"FINDING-3","status":"RESOLVED","axis":"materiality / revision effects","mechanism":"Prohibition on cross-revision Duplicate outcomes","precondition":"Validators or their shared semantic model omit a changed cross-revision behavior.","event":"Two records from distinct source revisions are compared.","observable_failure":"Before P3, false agreement could suppress the changed behavior as a duplicate; P3 now always emits New across revisions.","falsifier":"Any distinct-revision path yields Duplicate.","first_observed_stage":"REVISION"},{"finding_ref":"FINDING-4","status":"OPEN","axis":"materiality","mechanism":"Same-revision canonical structured equality","precondition":"A producer omits the same material actor, condition, dependency state, or failure branch from two same-revision records.","event":"The records compare exactly equal and have identical artifact/configuration identity.","observable_failure":"Materially distinct failures are classified Duplicate because the distinction never entered the evidence envelope.","falsifier":"Independent completeness tests establish that every material precondition, event, observable failure, effect, impact, and uncertainty changes canonical evidence or produces Invalid/Indeterminate.","first_observed_stage":"REVISION"},{"finding_ref":"FINDING-5","status":"RESOLVED","axis":"audit semantics","mechanism":"Diagnostic-only authority for P2 extractors, manifests, and conformance artifacts","precondition":"Diagnostic evidence disagrees or has incomplete mutation coverage.","event":"An implementation attempts to use diagnostic output to determine or override disposition.","observable_failure":"A diagnostic artifact incorrectly changes Duplicate, New, or Indeterminate classification.","falsifier":"Any diagnostic artifact independently determines or overrides an outcome under P3.","first_observed_stage":"CHIEF_STAGE_1"}],"chief_disposition":"APPROVE_WITH_REQUIRED_CHANGES","limitations":["Closed-world run; no external evidence or unrelated workspace artifacts were inspected.","Authenticated revision-to-artifact/configuration binding evidence was unavailable.","Approval requires a pre-implementation completeness gate that routes unproven same-revision equivalence to Indeterminate.","Rule-precedence and diagnostic-isolation conformance tests remain required before Duplicate outcomes are enabled."]}