{"case_id":"F3-noisy","run_id":"F3N-FIXED-P4-MEDIUM1","protocol_conformant":true,"audit_valid":true,"cycles_used":3,"terminal_findings":[],"chief_disposition":"APPROVE","limitations":["HYPOTHETICAL: Label syntax and value domain are unspecified; non-blocking.","HYPOTHETICAL: Metrics-stack resource effects are unspecified; non-blocking.","HYPOTHETICAL: Consumer, topology, and privacy characteristics are unspecified; non-blocking."]}