{"case_id":"F3-short","run_id":"F3S-ADAPTIVE-T2-MEDIUM1","protocol_conformant":true,"audit_valid":true,"cycles_used":1,"terminal_findings":[{"finding_ref":"FINDING-1","status":"OPEN","axis":"correctness","mechanism":"The bounded, non-sensitive label contract depends on a closed enum, total canonical mapping or suppression, prohibited raw/fallback passthrough, and privacy/path validation; P1 makes these blocking gates, but supplies no results.","precondition":"An emission path bypasses canonical mapping or permits an unclassified or sensitive value.","event":"Instrumentation emits the audit label through that path.","observable_failure":"Cardinality exceeds the declared value set or sensitive data appears in telemetry, violating the label invariant.","falsifier":"Closed-enum and total-mapping evidence, canonicalization or suppression for every input, privacy classification, and passing path/bypass tests.","first_observed_stage":"P0"},{"finding_ref":"FINDING-2","status":"OPEN","axis":"operability","mechanism":"The additive label multiplies series across existing dimensions; P1 gates expansion on capacity projections, canary evidence, independent degradation detection, and rollback triggers, but those results are absent.","precondition":"Existing exporter or backend utilization is near a quota, capacity, retention, or cost boundary.","event":"The additive label creates the new series cross-product.","observable_failure":"Samples are rejected, dropped, delayed, or unexpectedly increase series growth, cost, or retention pressure.","falsifier":"Baseline measurements, complete cross-product projection, declared headroom, passing canary results, independently visible degradation signals, and validated rollback triggers.","first_observed_stage":"P0"},{"finding_ref":"FINDING-3","status":"OPEN","axis":"compatibility","mechanism":"Adding the label changes series identity and potentially query shape; P1 requires exact-stack and material-consumer validation, but no compatibility results are supplied.","precondition":"A backend enforces label expectations or a dashboard, alert, recording rule, or query is dimension-sensitive.","event":"New labeled series coexist with historical unlabeled series or enter the consumer path.","observable_failure":"Ingestion rejection, split or duplicate panels, changed alert vectors, or discontinuous historical comparisons.","falsifier":"Passing tests for the exact exporter/backend and a complete inventory of material dashboards, alerts, recording rules, queries, and historical-overlap behavior.","first_observed_stage":"P0"}],"chief_disposition":"DEFER","limitations":["The case was treated as a closed world; no external evidence or unrelated workspace artifacts were inspected.","All three terminal findings remain evidence-gated; P1 specifies blocking controls but provides no gate results.","Separate fresh subagent threads and distinct role contracts provide observable instruction and context separation, not proof of cognitive independence."]}